{
  "$schema": "http://json-schema.org/draft-07/schema#",
  "type": "object",
  "required": ["id","displayName", "description", "authors", "artifacts", "urls"],
  "properties": {
    "id" : {"type": "string" },
    "displayName": { "type": "string" },
    "description": { "type": "string" },
    "tags" : {
      "type" : "array",
      "items" : {"type" : "string"}
    },
    "imageUrl": { "type": "string", "format": "uri" },
    "imageHash": { "type": "string" },
    "urls": { 
      "type": "array",
      "items": {
        "type" : "object",
        "required": ["name","url"],    
        "properties": {
          "name" : {"type": "string"},
          "url" : {"type": "string", "format" : "uri"}
        }    
      }
    },
    "authors": {
      "type": "array",
      "items": { "type": "string" }
    },
    "isClientOrServer": {
      "type": "string",
      "enum": ["Client", "Server", "Both"]
    },
    "githubOwner" : {"type": "string"},
    "githubRepoName" : {"type": "string"},
    "autoUpdateArtifacts" : {"type": "string"},
    "releaseTagPrefix": {"type": "string", "minLength": 1},
    "releaseAssetName": {"type": "string", "minLength": 1},
    "artifacts": {
      "type": "array",
      "items": {
        "type": "object",
        "required": ["fileName", "version", "downloadUrl", "category", "type"],
        "properties": {
          "fileName": { "type": "string" },
          "version": { "type": "string" },
          "category": { "type": "string"},
          "type": { "type": "string"},
          "gameVersion": { "type": "string" },
          "downloadUrl": { "type": "string", "format": "uri" },
          
          "extends": {
            "type": "object",
            "required" : ["id","version"],
            "properties": {
              "id" : { "type": "string" },
              "version": { "type": "string" }
            }
          },
          "dependencies": { 
            "type": "array",
            "items": {
              "type": "object",
              "required" : ["id","version"],
              "properties": {
                "id" : { "type": "string" },
                "version": { "type": "string" }
              }
            }
          },
          "incompatibilities": {
            "type": "array",
            "items": {
              "type": "object",
              "required" : ["id","version"],
              "properties": {
                "id" : { "type": "string" },
                "version": { "type": "string" }
              }
            }
          }
        }
      }
    }
  }
}