{
  "id": "BLIND",
  "displayName": "B.L.I.N.D. - Sensor Suite & FLIR",
  "description": "Adds advanced multi-spectrum FLIR (Ironbow, White Hot, Black Hot), dynamic NVG night vision to targeting pods and ground laser target designation support.",
  "tags": [
    "QoL",
    "Flavor",
    "Aircraft"
  ],
  "urls": [
    {
      "name": "info",
      "url": "https://github.com/XBarni999/B.L.I.N.D"
    }
  ],
  "authors": [
    "Phantasm"
  ],
  "isClientOrServer": "Client",
  "githubOwner": "Phantasm",
  "githubRepoName": "BLIND",
  "autoUpdateArtifacts": "True",
  "artifacts": [
    {
      "type": "plugin",
      "fileName": "BLIND-0.5.0.zip",
      "downloadUrl": "https://github.com/XBarni999/B.L.I.N.D/releases/tag/v0.5.0",
      "gameVersion": "0.32",
      "version": "0.4.3",
      "category": "Release",
      "hash": "sha256:d01f67b993efc64b3861b110ed40a965ae47483b79357dcc6d7ad06ec30f00f9"
    }
  ]
}
