{
  "id": "LiveryManager",
  "displayName": "Livery Manager",
  "description": "Tiny clientside mod to make dealing with lots of liveries a little less horrible.",
  "tags": [
    "mod",
    "QoL"
  ],
  "urls": [
    {
      "name": "info",
      "url": "https://codeberg.org/maevi/nuclear-option-mods/src/branch/main/livery-manager"
    }
  ],
  "authors": [
    "maevii"
  ],
  "autoUpdateArtifacts": "False",
  "artifacts": [
    {
      "fileName": "livery-manager-1.0.0.zip",
      "version": "1.0.0",
      "category": "release",
      "type": "plugin",
      "gameVersion": "0.32",
      "downloadUrl": "https://codeberg.org/maevi/nuclear-option-mods/releases/download/livery-manager-1.0.0/livery-manager-1.0.0.zip",
      "hash": "sha256:af443d939b0279d83113e3b966821388175f5bc24514d4e4c88414102f143b2e",
      "dependencies": [
        {
          "id": "BepInEx.ConfigurationManager",
          "version": "18.4.1"
        }
      ]
    },
    {
      "fileName": "livery-manager-2.0.0.zip",
      "version": "2.0.0",
      "category": "release",
      "type": "plugin",
      "gameVersion": "0.32",
      "downloadUrl": "https://codeberg.org/maevi/nuclear-option-mods/releases/download/livery-manager-2.0.0/livery-manager-1.0.0.zip",
      "hash": "sha256:8153a19ecab7de1600012b38a889a0492cabb7324637b2617a809affb071717e",
      "dependencies": [
        {
          "id": "BepInEx.ConfigurationManager",
          "version": "18.4.1"
        }
      ]
    }
  ]
}
