{
  "id": "LoyalWingman",
  "displayName": "Loyal Wingman",
  "description": "Nuclear Option 0.34 compatibility prerelease of the Loyal Wingman plugin.",
  "authors": [
    "Loyal Wingman contributors"
  ],
  "urls": [
    {
      "name": "info",
      "url": "https://github.com/NOLoyalWingman/LoyalWingman"
    }
  ],
  "githubOwner": "NOLoyalWingman",
  "githubRepoName": "LoyalWingman",
  "autoUpdateArtifacts": "True",
  "artifacts": [
    {
      "fileName": "LoyalWingman.dll",
      "version": "0.0.2",
      "category": "preRelease",
      "type": "plugin",
      "gameVersion": "0.34",
      "downloadUrl": "https://github.com/NOLoyalWingman/LoyalWingman/releases/download/v0.0.2/LoyalWingman.dll",
      "hash": "sha256:91c9eefa32fe784a9adc852c27ba8c525f3dcd9d611d669aaa0070d88c4c5c6f",
      "dependencies": [
        {
          "id": "com.nikkorap.blueprinter",
          "version": "1.8.21"
        },
        {
          "id": "blueprinter.kestrel",
          "version": "2.2.0"
        }
      ]
    }
  ]
}
