{
  "id": "com.equalizer.ground",
  "displayName": "Equalizer Mod (Ground Vehicles)",
  "description": "Equalize modded ground units with vanilla at spawn.",
  "tags": [
    "QoL",
    "Utility"
  ],
  "urls": [
    {
      "name": "info",
      "url": "https://github.com/SonPamungkas/Nomnom-Mod-Releases/releases/tag/v2.1.b"
    }
  ],
  "authors": [
    "Neutral Observer"
  ],
  "githubOwner": "SonPamungkas",
  "githubRepoName": "Nomnom-Mod-Releases",
  "autoUpdateArtifacts": "True",
  "artifacts": [
    {
      "type": "plugin",
      "fileName": "com.equalizer.ground_v1.0.0.zip",
      "downloadUrl": "https://github.com/SonPamungkas/Nomnom-Mod-Releases/releases/download/v1.0.0/com.equalizer.ground_v1.0.0.zip",
      "hash": "sha256:033e7e8bcf15bc80ef43377cca7fac7bb0d9b45bb20dbbd8f54dfb5e8bd1a9da",
      "gameVersion": "0.33.3",
      "version": "1.0.0",
      "category": "Release"
    }
  ]
}